{"$schema":"https://schemas.cratis.io/factory/v2/artifact-descriptor.schema.json","classification":"internal","contentHash":"sha256:495f7f50dd08e5d1dbdf36693c2402014e9f621a98ba769ca7876ae5a7371dbf","documentKind":"artifact-descriptor","kind":"agent-context","mediaType":"application/json","protocolVersion":"2","reference":"artifact:sha256:495f7f50dd08e5d1dbdf36693c2402014e9f621a98ba769ca7876ae5a7371dbf","schema":{"contentHash":"sha256:a0834645aaa41f90f28da5dfdd8628984a56ff342e1fa6854c59a23aac20bb6a","id":"https://schemas.cratis.io/factory/v2/agent-context.schema.json"},"sizeBytes":1280}
